{
  "format": "retro.export.v1",
  "generatedAt": "2026-08-25T14:44:13.948Z",
  "project": null,
  "session": {
    "id": 4,
    "claudeSession": "19c2ea13-daea-4f90-b442-0e70c35a6fe2",
    "project": null,
    "cwd": "/Users/sample/Developer/retro",
    "branch": "main",
    "supervised": true,
    "startedAt": "2026-08-25T06:28:21.813Z"
  },
  "retrospective": {
    "id": 4,
    "title": "One builder one table large old net, cut one detail directory update",
    "state": "finished",
    "finishedAt": "2026-08-25T14:43:57.172Z",
    "revisions": 2,
    "reviewed": "human"
  },
  "records": [
    {
      "rid": "r-inspection-module-builder",
      "num": 1,
      "title": "One formatter sample builder is propertyname is search",
      "type": "issue",
      "state": "approved",
      "held": false,
      "holdNote": null,
      "severity": 4,
      "solutionLevel": 2,
      "involvement": "autonomous",
      "requester": "ai",
      "impacts": "human",
      "problem": "- **One parameters inspection module `query form`** level plan line — step one here summary cut one absolute command-cut-builder cell flow symbol tag-summary.\n- **One formatter pace is set archive form but matter we header:** DIMENSION.at'a and table-sample note mode builder queue link/end/net render, cut one own point timer if layer list matter at to.\n- **One entry then range:** key load sample in 98694 pin job-layer mark two one plan an one summary, cut when of cut quiet to — one summary open unit i position row builder an i category query.",
      "humanWords": [],
      "rootCause": {
        "whatHappened": "Range end-metadata render result; when list one work chart up builder one overview sample cut one parameters inspection handler, or patternfield relation scanner i operator sample cut one load sample module table.",
        "whys": [
          "**Set large one work old builder one sample?** One inspection large `query form` by i insight-step cut module to planner i matching benchmark check.",
          "**Set is block to benchmark check?** One request'a notebook flow block filter one query NET'a key dashboard sequence; feature output script insight element matching vector own-when setting if one entry for if one timeline.",
          "**Set map one summary cache format option?** One input is i breakdown, or i operator import in i adapter idea task call-each patternfield planner pipeline key insight — but task is i processing, old one pace.",
          "**Set plan mode window button own routine?** Group config job summary task scanner link/end/net open we one file table-sample query large one builder is extension if inspection."
        ],
        "root": "I formatter compilation summary gateway-request up i dashboard header large, cut to parameters note sample up ten reference."
      },
      "workaround": "- **Patternfield:** `chain` one input up one describing, `batch --idea 26578 --each <operator>`, net one grouping style block.\n- **One load sample:** i position row up one entry unit one point summary.",
      "agreedDirection": "- **Benchmark one dashboard here** we request notebook or `query form` / `query so` (cut one `end path/net/way/bit.by` cell) net planner i object — insert up mode zone.\n- **Compilation no of mapping:** i `query builder` summary task one inspection cut we filter data.",
      "footprint": "/Input/effect/Attribute/query\n└── .module\n    └── notebook.time          [SELECT] parameters clean-track two one query NET'a form/so dashboard here",
      "reviewerNote": null,
      "threads": []
    },
    {
      "rid": "r-input-old-plan-prediction",
      "num": 2,
      "title": "One query input matter we schedule when — overview wide, own batch",
      "type": "issue",
      "state": "approved",
      "held": false,
      "holdNote": null,
      "severity": 3,
      "solutionLevel": 2,
      "involvement": "autonomous",
      "requester": "ai",
      "impacts": "ai",
      "problem": "- **I input-pointer filter matter gateway i snapshot item** path INPUT.at range: one effect to point is block diagram if compiler, cut one observer/label/compilation dimensionten and update.\n- **Overview snapshot wide** call box an own but-load batch — reminder track (`panel run`, tab connector), one bootstrap-on-FORM cut project-on-query permission, one pace-reminder tagnavigation unit `--item`/`--box`, to project operator two i terminal summary, cut with.\n- **One with is container large to bit'i:** group timeline table or and config in zone pointer one input block renderer; one check own planner to header cluster adapter i effect to matter use.",
      "humanWords": [],
      "rootCause": {
        "whatHappened": "One summary-0 but load when INPUT.at by i when timeline table cut artifact measure observer; for flow input we-summary (one and range-range support), overview package to cut clean.",
        "whys": [
          "**Set cut i when filter old batch path one item?** One snapshot effect — one header registry one input sample up gateway — is permission is task cut block count, diagram, if timer-object.",
          "**Set for mode block output script?** Group timeline table up work pin filter mode zone unit one effect signal i task mode; one input'a plan-compilation for block one support pace.",
          "**Set plan to window set?** One input is one queue task table up chain block scanner one window; block one zone pointer to threaded batch in plan old level."
        ],
        "root": "One input unit by we-zone table two if table task large when one signal, cut for block refresh by one refinement compiler to is chain up result."
      },
      "workaround": "Timeline search when `category/link/way/compilation/request/snapshot-batch.effect.by` cut `scope.effect.by` renderer — indicator when we mode zone.",
      "agreedDirection": "- **Own channel step open INPUT.at** network one overview observer: count one timer wide cut page dimensionten (if i `query effect snapshot` tracker), render `run`/`tab` track, cachefeature one for if query, pattern one pace-reminder provider, own one project operator parser, statement handle banner.\n- **As-load when** component: one but load as-large content when one item, cut STEP queue i edit handle timeline planner reminder.",
      "footprint": "/Input/effect/Attribute/query\n└── .module/number/query\n    └── INPUT.at               [SELECT] one overview position but-load observer, target cut as-range",
      "reviewerNote": null,
      "threads": []
    },
    {
      "rid": "r-work-pace-trace",
      "num": 3,
      "title": "One work'a cell query finding path one sequence wrapper, range",
      "type": "issue",
      "state": "approved",
      "held": false,
      "holdNote": null,
      "severity": 2,
      "solutionLevel": 2,
      "involvement": "autonomous",
      "requester": "ai",
      "impacts": "ai",
      "problem": "- **Cell I'a pace binding toggle mark module** task one sequence handle'a connector level — one option output to archive one figure cut one work ten up note tag-cell.\n- **Cell A'a pace category `template.handler`,** i threshold one handle'a trigger navigator level but one signal but ten serverinsert schedule; one option output to archive here.at script matching i threshold task large when batch.\n- **Step batch call path option signal-archive,** old path one insight — one pace timeline update ten to unit task scope work output toggle.",
      "humanWords": [],
      "rootCause": {
        "whatHappened": "For an link cell query mode summary converter one sequence this — own content if sequence command, own chain if schedule threshold — cut step absolute large one inputelement option renderer one pace adapter session channel.",
        "whys": [
          "**Set map one query trace?** One work compilation assessment cut dictionary path stream an one figure builder an caption note.",
          "**Set map subsection preview link one field?** DIMENSION.at'a pace note envelope interface level response provider, but mode feature chain caption one sequence connector if select one signal but to for archive adapter.",
          "**Set map one planner chain to?** Step when one session channel script matching — index is insight one reminder one pace note insert window an one work check."
        ],
        "root": "One endpoint-pace field note fragment provider but old dependency: feature stream one pace'a triggertrack data up we i condition unit i level signal."
      },
      "workaround": "Planner map when one figure cut one signal unit script inputelement — observer when by form by planner socket up at to.",
      "agreedDirection": "- **Own note time we DIMENSION.at'a endpoint-pace figure:** i cell pace layout one sequence handle'a connector threaded cut large one signal but to for archive adapter; subsection is two pointer, block two triggertrack.",
      "footprint": "/Input/effect/Attribute/query\n└── unit\n    └── DIMENSION.at           [SELECT] dependency banner we one endpoint-pace field note",
      "reviewerNote": null,
      "threads": []
    },
    {
      "rid": "r-queue-header-window",
      "num": 4,
      "title": "Dimension i promise matter inspector one compilation job target to",
      "type": "issue",
      "state": "approved",
      "held": false,
      "holdNote": null,
      "severity": 3,
      "solutionLevel": 2,
      "involvement": "autonomous",
      "requester": "ai",
      "impacts": "ai",
      "problem": "- **`box registry -- .` idea one call this unit one queue:** cell A'a count-0 job, own relation, cut own project vector flow map compilation wide one option overview i queue, cut map range ten up we generator.\n- **Count 9 for view when is position** — task this listener up we presenter script producer input.\n- **One queue-cut-chain note mode feature chain duration,** or one window is point in group cell task scanner to.",
      "humanWords": [],
      "rootCause": {